id	comment_text	toxicity	gender
5828614	Jesus turned the other cheek when he was struck but when he saw others being punished, as the woman who was about to be stoned, He intervened and when he saw people being ripped off by money-changers in the temple He even used violence to drive them out and prevent them from harming others. What you are asking is for us all to look aside from evil and do nothing to intercede when we see it harming others. That is not Christ-like.	0	0
6216653	"Denise,

It warms your heart that your husband was blowing your child kisses?
Why? Is this considered ""not masculine enough for you?""
Am I not capable of demonstrating affection to my own son on account of my being male?

How do you expect to raise a son with a ""whole, healthy"" future if your job during the day is predicated on hammering out divisive, unsubstantiated hackjobs?"	0	1
5188651	There are misogynist women. Like the brides of ISIS, for example. Or perhaps you think western countries don't have them?	1	0
6224096	Its kind of like all those sexually abused Hollywood women who are now coming out of the wood work by the hundreds exposing their tormentors,even old HW Bush got his dick slapped for pinching some woman's ass from the confines of his wheelchair.The demo's will sing like canary's once the first ones start chirping.	1	0
5514718	These women were mothers daughters friends and truly good people at heart. No matter what they did they deserve to be called women.the one killed was a dear friend to myself and many others so fuck off man	1	0
5420347	"While the author's intentions may be noble, it has been long established that two wrongs don't make a right.

He is, in fact, advocating for discrimination against 'white, straight males' and without a defined end point.  What exactly has a 20-something young man, raised in an egalitarian generation and era, done to warrant such punishment, other than being born white and likely straight? He did not commit the sins of generations prior -- why should he do unlimited penance for them?  Is it not wrong to discriminate against someone based on the colour of their skin, regardless of the reasons?

Moreover, it completely ignores the overall demographic shift and the fact that it takes many years, if not decades for a cohort to work its way through a system, and ultimately the trend is more important in determining what, if any action should be taken.

Encourage 'non-traditional' candidates to engage?.  Absolutely.

Perpetrate discrimination against a declining demographic? Absolutely not."	0	1
773058	34 and all growed up and smart. sigh. 'potential body'? sadly laughable. autism went from 1 in 5000 in 1970 to 1 in 250 in 2000. but then, it is nobody's business what women choose to do to that ball of cells, well, until they want the taxpayer to pay up! taking care of people is everyone's business, and people are charged with murder for 'killing a fetus', and distributing for giving them drugs. so while you may be free, you certainly have little soul.	0	0
6002485	"This ugly ""woman"" ,should go back to selling toilet cleaner,
and building stadiums,
and stay out of the Co-Eds"" bedroom."	1	0
5338966	"You know, this isn't bloody rocket science... you can't criminalise ""sex work"" without criminalizing sex, period. Our overpaid overlords have decided that they have the indisputable right to dictate the sexual behavior of consenting adults - a woman selling her body (and the rest of her life) for a wedding ring is somehow ""moral"" (and according to them, ""legal""), but that same woman having sex with someone for money is somehow ""immoral"" (and , according to them, ""illegal""), and that this ""distinction"" somehow gives them the right to use their uniformed, taxpayer-funded goon squad to harrass, repress, and even kidnap said consenting adults because of it. If this idiocy isn't proof that governments do far more harm than good and needs to be abolished, nothing will."	1	0
6267457	I guess we can get rid of all those NGO's and taxpayer supported organizations that have been promoting girls and women to take science and technology for the last 30 years, because clearly they don't work.	0	0
5995607	And Lot was 'a Godly man' if I remember my scripture correctly.	0	1
5337307	"""You throw like a girl""  does not equal ""You're a f**g""."	1	0
5810014	I share Walt Heidenfelder's view that not all statues of Confederate heroes should be taken down, but on the other hand, if their cause was slavery and the denigration of a class of human beings, and the denial of their freedoms, then those men were not heroes  -  and should not be glorified.   If removed, those monuments could be well-placed in museums and exhibited as aberrations in this nation's quest for equality.	0	1
5072655	Focused on women's sexuality was the thrust of the article, yet Sapphic Aquatica, the club's regular lesbian event was not even mentioned. Same old sexist homophobic b.s. Lesbians just don't exist. Disappointing G&M.	1	0
5493064	A Hamas sympathizer, truly pathetic. Hamas doesn't want peace, they reward the families of rabid terrorists who stab pregnant women in grocery stores. Interesting how the left jumps on the anti-Israel bandwagon despite the fact Israel is an island of ingenuity and progress surrounded by regressive zealots who murder homosexuals through summary executions in the streets. Gaza is run by unapologetic fanatics and the left's silence is deafening - it's inexcusable ignorance. Tell me Dante, I missed the pride parade in Gaza this year (and last year, etc.), I suppose the BDS calls that cultural relativism? Talk about shameless.	1	0
5983085	Hillary, that icon of Marxist women, is a Victorian wife, dependent on her husband for protection, support, and social standing.  And the women who support her and think otherwise are too stupid, deluded, or filled with rage to see their heroine is a throwback to another century.  LOL	1	0
592620	Well that would require you to believe that ALL the women who came forward about Trump are liars and that even his comments he made that were recorded was just him engaged in more BS.....is that what you are saying?....  My view of misogyny includes not having sufficient respect for women that you think their bodies are yours for the grabbing rather than theirs to decide.	0	0
6243156	Ashley Judd. Do NOT pity Weistein or advise him to seek therapy. His criminality is incurable and is ingrained into Hollywood culture. Arm yourselves and shoot him and any rapist. It will be worth it. The public and jury will understand. Chief Ballard will understand. You are terrified and have no means of escape. The cops are not around to help. So shoot, shoot, shoot them until they are dead. I guarantee you a wave of calm will finally engulf you and bring everlasting peace.  They will no longer rape another female again. You will become the best spokesperson for women against rape.	1	0
5019824	B.Carfree hasn't provided 'a credible source' for one of his statistical rants in the memory of man!	0	1
971042	"""The apology was accompanied by a settlement agreement respecting two class actions suits with allegations included rape, unwanted sexual touching, physical assault, sexist comments, threats, gender discrimination, harassment and bullying.""

As a woman who was raped by a stranger back in the days when rape was a separate offence under the criminal code, it infuriates me when rape and sexist comments are given some type of equivalency, as it trivializes the gravity of what I experienced."	0	0
826249	Because crime prevention does not fit in the general acceptance of stereo typing Alaska Natives, apparently it's a women's rights thingy to deny others right's.	0	0
1032060	Singling out a tiny group of women for punishment is vindictive. But you have made it clear that you don6give a fig for the women involved.	0	0
1011077	No one is generalizing and calling Canada Islamophobic, but Islamophobia is an issue.  Just look at about half of the comments whenever a Muslim woman writes an article, or the comments in response to this one.	0	0
5936043	"Wow is that a women of great influence and power speaking on the world stage on behalf of Trump ???
One must muse as the raging left continue to run from one hysteria to the next. 
What a joke"	0	0
5833052	"LW1:  I've found the level of flirtation is inversely proportional to their looks on the 1-10 scale.

My guess is the ladies have that same problem but with a direct proportional relationship to ego instead of looks."	0	0
269307	"Accounts of what I mentioned were published in both the San Diego Union-Tribune and San Diego Reader at the time, so there's at least some documentation of it.  And there seems to be some question with respect to your quote.  W. E. B. DuBoise worked with her.  It seems unlikely he would have if she made such statements as you claim.  In any event if that was her true purpose I've done my part to defeat it seven times over.  And counting.

Also, seems that the woman was more of a proponent of birth control than she was of abortion.  Church opposition to birth control seems self-defeating as an anti-abortion strategy.  I think this stems from an unhealthy Platonic Dualist/Christian view toward sexual fulfillment predicated on the fallacy that sex is inherently 'sinful' and religiously sanctioned for no other purpose but procreation.

We don't have that hangup--'enjoyment' is very nearly a euphemism for sex in our idiom.  Birth control is not prohibited in our faith.  Khalas."	0	0
600280	"Cathy Guay, thank you for your letter. I have a serious question for you, a couple actually, to which I would appreciate a response. I also invite other Trump supporters who share your views to respond to my question. You write that now Americans ""must work together — helping, not fighting each other.""

Do you have any ideas or suggestions for how Muslims, a group the President-Elect has suggested should be banned from the country, might join you to “work together”? Or Mexicans, whom the President-Elect has called rapists? How might they join you? Or women, whom the President-Elect rates by their physical attributes and has boasted of grabbing by the pussy?

Please tell us all how we might now be welcomed into this togetherness of which you write.

Thank you."	1	0
595285	"Ha ha ha ha ha ha ha ha ha ha ha ha! ""Let us resolve that if they come for any of us — Muslims, Hispanics, blacks, gays, women, geeks (like me) — they may as well come for all of us."" What does that even mean? Damn, these freakin people are coming unglued."	1	0
969669	"Raymond Burke lectures the world on sexual ethics but notice the absence of his lectures about the church's decades of molestation of children and the world wide violence epidemic against Women. Raymond Burke: Holy Mother Mary is the head of the Church aligning in Light with the Holy Spirit.  Raymond Burke is politicizing his 'agenda', blaspheming Pope Francis, coming to San Francisco--a space of safety and faith for ALL choices. Raymond Burke should defrock, and go get a job in a permanent confessional of those who posture the representation of the Word, but actually know nothing about it. Their egos would lecture us while they run rampant in their judgements  and betrayals of the Holy Spirit. Raymond Burke: Mercy is not your suit. ""Judge not or you will be judged. The meek shall inherit the Earth"". That counts you and Steve Bannon out."	0	0
5328867	When a worldview is based upon the words and deeds of man who conquered others and spread Islam by the sword (as opposed to a man dying on the cross, persecuted by the authorities), you can always expect some his followers to do the same.	0	1
252042	"How do you know “torture results in little more than false confessions”? 

Kerry reply on ex-gitmo prisoner returning to jihad …. “Well, Senator, he’s not supposed to be doing that.” http://drrichswier.com/2016/02/28/video-kerry-on-gitmo-prisoner-who-returned-to-jihad-hes-not-supposed-to-be-doing-that/

Why do you defend these unconscionable jihadists who hate America, women and homosexuals?"	1	0
279081	No arguement from me William.      I feel both sides of the conversation may speak their mind, even attempt to persuade, but the choice is the woman's and we know that she will be the person who accepts responsibility either way.	0	0
5836507	LW1 I had several women hit on me right after I got married, I turned them down. Now that I am older and my marriage had gone down hill, I regret the fact that I turned them down. If the are good looking and want you, all I can say is, go for it.	0	0
776699	"It says so right in the Koran: ""Strike the neck (behead) of non believers.""   It also says to throw homosexuals off from tall places, like buildings.  and to stone adulterers(who is defined as women who have been raped, a double indemnity for being female)   You can Google search pictures of such events.    These things are  Islam in action.."	1	0
5308423	Based on Jim's comments in the past (I don't remember specifics, because I don't keep track of everyone's comments), I have no reason to believe that he does not support ordination of women or that he wishes us any harm.	0	0
5956705	Thank you Mr Morell.  This country needs more men like you.	0	1
6007328	No we will be demanding that 50pct of the US workers that make parts be female, 75pct a visible minority and  $$$ must be given to US indigenous peoples.	0	0
6194566	A poste elsewhere says it's about womens rights but I agree with you that it's being sold on the tenuous grounds of security. It's hard to see the security argument when they added in August that a woman could not board a bus or metro while wearing a burqa! STM employees and municipalities across Quebec have already said that they will not enforce this toxic piece of legislation which is going to wither on the vine.	0	0
521765	"Wow, quoting WikiLeaks. How about if I quote Breitbart. ""Women on birth control are fat and ugly."" True headline. And I'm not a Clinton fan btw."	1	0
827715	"Trump does far more than speak of women.  He also rapes and molests them, and violates their privacy.  

Trump is the perfect pervert, and should be locked up.

Only God knows what disgusting sexual perversions are going to go on at the White House, once Trump assumes office."	1	0
960576	Males respond emotionally to these cues, that is true, but it is the responsibility of those males to not act inappropriately to them when it is encountered.	0	1
5384604	"Celibacy?!?! You do realize that the majority of pedophiles are -married- men with seemingly normal families, do you? You do realize that the professional child welfare investigators that root out pedophiles for a living, to them the Roman collar is hardly even a blip on their radar, do you?

Affront to survivors?!?! You DO realize that -this- survivor, along with the vast majority of other survivors, were NOT abused by a Catholic priest, but by someone from probably your very own own demographic, and WE view your myopic tunnel vision towards priests as not only stupid, but even dangerous....do you?"	1	1
5041015	I would assume that in keeping with the government's stated desire of gender parity that they will be hiring 50% male researchers and activists as a requirement of getting the money.	0	1
5086237	"Why is it that all the unfounded main examples involved excessive drinking? Surely there were just as many sober women with complaints as well? No? 
We had two articles on drinking and sexual assault last week and both were met with complaints that when you get right down to it are demanding that society be an enabler for excessive drinking. Now this court case. IMHO it is truly mind boggling."	0	0
5957330	It is an issue because of the perception that EF folks are also agaisnt the Council as a whole, or I am guessing at least on the part of Fr. Tom. He is on Facebook. Ask him. Or ask MJ, who would seem to like the EF as a rebellion against modernism. I am no fan of loyalty oaths. Indeed, on some questions, like female ordination and HV, and its counter-modern predecssor Castii, I believe the Church is both behind the times and in error, yet I like the use of Latin in Mass and sing Adeste Fidelis loud, so maybe there is no consistent pattern. Still, MJ and folks like Crisis and Church Militant make EF devotees a target. How you want to handle that is up to you.	0	0
6072889	"It is interesting I have felt this compelling of the Holy Spirit telling me to bring up to fellow Catholics that we  need to discuss sex with each other & with honesty.  There is a theology to the body but we have it written out incorrectly in many ways and this has led many feeling imprisoned by their flesh.

I am not lesbian.  However, I was called after confession to seek ordained priesthood in our church when I was a teenager.  The ongoing rejection of the people I love, and of the hierarchy I love, made me hate my body for many years and made me feel ashamed of being female.  I did many really self-harming things in those days until God managed to put my pieces back together.  Then he showed me how he needed me to fight for the church I love to be true to Christ as it has not been since its first 100 years.  I needed to stand up and start demanding the end of all sexist teachings and practices while praying for God to change these things too.  

We need honest talk on all sex now."	0	0
6178459	The man had no choice. Primarily, It IS congress's job not the Prez. He's trying to get threm off theor asses and it is working. Congress has the opportunity to deal with DACA NOW if they do get off their collective asses	1	1
614225	"You say: ""Jesus has not come because the people of this world are not ready."" I respectfully submit Jennifer, the Messiah never comes back, never has. Read the historical expectation of deliverance in the multi-millennia of recorded history and you will  read the countless unmet expectations, the utter disappoint of abandonment, in the cries for deliverance by untold tormented people, and you will see for yourself. 

The sinfulness of humanity is always blamed, an assignment of collective neurotic guilt for which there is no actual basis. It's in fact a blanket excuse-note to let deity off the hook for its delinquency in disregarding cries for rescue. It's the same dynamic of abused people, mainly women, who blame themselves for the work of their abusers.

How would humanity look if it was ready? How can it ever get there? Cultures that have endured the most horrible atrocities would surely trigger His return, wouldn't they? How more ready than that? Caring is human, not Godly."	0	0
6177673	It's not your fault you have no idea what it's like to be a woman. But you might try listening to one instead of telling them what their experience is like.	0	0
5777538	"The driver charged with killing a woman at a white nationalist rally in Charlottesville was previously accused of beating his mother and threatening her with a knife, according to police records released Monday.

Samantha Bloom, who is disabled and uses a wheelchair, repeatedly called police about her son, James Alex Fields Jr., in 2010 and 2011, telling officers he was on medication to control his temper, transcripts from 911 calls show.

In another incident in 2010, she said her son smacked her in the head and locked her in the bathroom after she told him to stop playing video games. There was no indication in the records that he was arrested.      Cont............."	0	0
5952911	"Your interpretation of ""progress"" in Myanmar includes perpetrating a crime against humanity. 

Having one woman under house arrest for many years is not too high a price to pay for democracy. But ethnically cleansing hundreds of thousands of people from a beleaguered minority is too high a price to pay. 

Suu Kyi's is silent while her military perpetrates a crime that no democracy would tolerate. That indicates there has been no progress on democracy in Myanmar. She's a willing puppet, dancing to give the masses the false impression that democracy has arrived."	0	0
712906	"I disagree with those heaping so much praise on the article. It deserves criticism. Even the writing of a 17 year old, which it is, deserves criticism.

The key passage of the article is this: ""Recently, I sat in my school library and watched, paralyzed, as a group of white men made a “Heil Hitler” salute toward a leader named Richard Spencer in Washington. They cheered violently as my people were referred to as a “soulless golem” controlling the media.""

And that is all we are told about that.

Hello?

Who exactly were those ""white men""? Were they fellow 17-year old-students being what 17 year old students often are - insensitive and immature jerks? Were they neo-nazi middle aged janitors wearing blue overalls? Were they Islamist men with beards yelling ""Allahu Akbar""? Were they students who knew her and who were goading her because she was there?

Sorry, but the piece falls flat. And all the focus on white right-wingers without a mention of Islamists? Ridiculous in this era."	1	1
5092430	"As well, if you are insinuating that food will unite the ever disparate groups in Canada you are WRONG. 
What will help fix the growing problems would be to end the Marxist activism. That includes an end to official multiculturalism which actually DIVIDES people AND identifies them permanently by race. 
This would also include a cessation to the endless feminist activism and replacing that with promoting the existent Canadians already here to have babies and strong families again. Your naan and halushky, however much delicious, is not the answer.
P.S. I was raised in our neo-Marxist society. We were told that a fetus wasn't a baby yet; that it was just a blood clot basically. A fetus develops a heartbeat 3 weeks after fertilization; almost nobody gets an abortion that early. That was in the 1990s. Not sure what they are teaching today but many young people would have had a different reaction to know they are destroying their own baby with a beating heart."	0	0
5962100	What about if the person I'm talking to is an idiot?  I encounter that a lot in here.  And yes, the idiots are frequently--but by no means exclusively--women.	1	0
1031129	"I saw this exceptional film last night, and decided to take a peek at your review.  With all due respect, I do think you missed the point.  It is difficult to watch, because war is hell. I cannot imagine a worse place to be, because there wasn't.  For a young man, a conscientious objector, to go through the eye of this needle, this insanity without a weapon, and come out of this battle rescuing 75 men, would be ludicrous, if it weren't true.  It is Gibson's genius in the telling that leaves you with the strong dis-taste for war at all.  Which I do believe is his point. An aside that another brilliant anti-war piece, maybe the best of all time, is Ralph Bakshi's ""American"" Pop.""  Not to be missed."	0	1
5415224	"Here is a perfect example set out by Confucius for the cultivation of the self.  Basically Mr. Chan is calling upon us to be virtuous.  Courtesy and trustworthiness are in decline.  As the Chinese are wont to say, ""Women bixu xuexi ta - We must study him"".  Hopefully Mr. Chan will recover and teach us wisdom. Thanks."	0	0
876233	LOL... this pussy on the head thing  is totally Freudian.   I don't recall women protesting when Slick Willy put a cigar in Monica Lewinsky.  Wat up wit dat?	1	0
874364	"The comment here by Rob Burns 335 accuses those of us who oppose Trump as being ""hateful"". Yet his candidate mocked a disabled reporter, bragged about molesting women, duped people enrolling in a fraudulent ""university"", and repeatedly stiffed subcontractors who did work on his projects, to list just a few of his transgressions. There is no point engaging in a civil discussion with him or, for that matter, most of the rest of the willfully uninformed Trump supporters. Personally, I very much dislike seeing my country become a laughingstock around the rest of the civilized world and intend to do everything I possibly can on a daily basis to frustrate the agenda of this hateful new president."	0	0
6148443	"Is there a single Canadian journalist out there who is willing to ask some difficult questions about this narrative instead of treating this man as a prodigal son with a joyous homecoming? A man who was married to Taliban royalty and who acted as the family spokesman for the Khadr family must have converted to Islam and had great sympathy for the family philosophy. Yet journalists stress his Mennonite upbringing. 
Is no-one in the media the least bit suspicious of the whole story?"	0	1
555853	Newt is a philandering hypocrite and failed politician.  Kelly knows who and  what he is, and you are calling her an idiot?  Are you a member of that 'good ol' boy' club, too?  Women like Kelly a too smart and strong for you.	1	0
5820814	I'm a black man that managed to survive the Jim Crow days. Do you miss the good old days when a white man could get away with murdering black people while they pray in church?	1	1
516275	Republicans can apparently say whatever they want about Mexicans, Hispanics, and African-Americans but the GOP draws the line at white women.	1	0
832069	Aga Khan is supposed to be a Muslim spiritual leader however Muslims in the Quran want to kill homosexuals and two married males were in Justin's family vacation?  Junior has claimed he and his dad read the Bible so what is it that Justin believes in or is it  just free glamorous vacations?	1	1
