id	comment_text	toxicity	gender
5418580	I sure hope that this man has rethought what he said. I'm having some venison and I hope he's having crow. So easy to just type some stuff - and so hard to take it back.	0	1
5996878	"Collard greens are deplorable because they taste awful.
Fried chicken, on the other hand, is yummy.
And, cotton balls are food fit only for female models."	0	0
5433564	U can rape all the women so long as they're not black. Just make sure U come home before bedtime.	1	0
5076926	Rino obstructionist who will fail to get party votes when Alaska will need them most.  She is not nepotism never works out.  Vote this woman out of office.	1	0
5729993	Politicians have created an environment of disillusionment so bad that one is inclined to be cynical wen asked what would Sol Plaatjie, Nelson Mandela, Albert Sisulu, Albert Luthuli etc have done. A lot of current ANC politicians were disciplined ad principled people, but somehow the trappings of fancy houses, German sedans, free travel and easy access to young ad beautiful women seeking to share those privileges tend to make people change. So it is difficult to maintain with absolute certainty that Sol Plaatjie would have taken the high road.....	0	0
5592386	I work in downtown Ottawa so I will definitely check out this new restaurant. I went to their website, which is in French only (the language toggle is not working). I like the name, but it is weird to see the the blue design when I was expecting red and white (like a radish). I wonder if a basic issue is that the chain will mainly appeal to women (just like a very similar salad chain: Green Rebel) - so they are immediately cutting out 50% of the market. Another problem is that this is a lunch-only restaurant.	0	0
916748	"What utter stupidity . . . to compare the gift of life to the gift of an opera ticket.  ""Incoherent"" more aptly describes the thinking of many women, including you, on the meaning of the life of in the womb.  Pregnancy is an ""instrument of torture""?  A ""perversion"" of the gift of sex and consequent life?  What spoiled offspring the left has produced.  Ingrates even to God.  Someone should write an opera about the year-by-year degradation of a culture that produces such women."	1	0
5824313	It's everyone's fault but the orange goofball. Just once I'd like to see him be a man and take blame for his stupid comments and ways.	1	1
6106626	The man is a crook.  Good riddance.	1	1
526384	"Cassie, I think what you say here is right on the money and very important.  The notion that Hillary Clinton viciously attacked the women who accused her husband has creeped into the national conversation as though it were a fact.  This report suggests that, at best, it’s an exaggeration:

http://www.cnn.com/2016/10/11/politics/hillary-clinton-donald-trump-bill-clinton-accusers/

And from whence comes the exaggeration?  A quick Google search leads -- of course it does -- to Breitbart, the de facto public relations arm of the white supremacist movement and until recently the corporate home of Steve Bannon, the white-supremacist and anti-Semite who is now the CEO of the Trump campaign."	0	0
5174709	"""Long standing rules of decency"" huh? I guess that leaves out all the Trump voters who support the sexual predator they put in the White House, a man who violates every sense of decency, not to mention the law, regularly.  Where was Minnery's concern when Trump was barging into naked teen girls' dressing rooms unannounced?  When he was bragging about ""grabbing"" women ""by the pussy,"" not to mention assaulting them by groping and kissing them?

Such hypocrisy. SMH."	1	0
5629135	"Making oneself a painted target for every low-life in viewing distance is hardly a way to keep oneself safe, just like flashing a fat wad of cash around probably isn't a good idea either. One can be legally right and still wind up dead or badly injured. Life isn't always fair, but if you use a little common sense you increase the odds of avoiding bad outcomes. Why is that so hard for some to comprehend?
Encouraging women and girls to be blissfully stupid is a strange way to show you have the ""best interests"" of them in mind. Not only does it increase their chances of being accosted or worse, but if a trial does occur their attire and/or consumption of drugs&alcohol will certainly be a point of interest. Encouraging irresponsible behavior, as Nelson is unwittingly doing, actually makes it worse for those women who practice responsible behavior to receive justice when they are assaulted. 
There may indeed be a ""rape culture"" here, but equally there is an ""idiocy culture"" as well."	1	0
583821	And you think it is alright for women to be allowed to kill their babies so you want the government to allow people to do what YOU think is right.	1	0
5660906	"It truly is disgusting to see all these obese women covered with tattoos and paying for their illegitimate children with food stamps. Sorry for being so stereotypical but far too commonplace.
Join a gym an go on a diet, get a job."	1	0
812005	I have yet to see a woman on a roof stripping shingles. Even carrying and nailing shingles. I have never seen a woman troweling concrete or working on a concrete crew. This equal rights foolishness has gone overboard.	1	0
6004101	The governor could do so much more, which is also why he shares responsibility.  He could declare the affordable housing and homeless situation a crisis/emergency and act accordingly.   He could call a special session and/or propose whatever funding mechanism or tax increase he deems appropriate and allocate a billion dollars or more toward implementing an aggressive plan.   Or he could speak out loudly in support of increasing the minimum wage or he could do any number of things  that are warranted by the desperate nature of the situation.  I like the governor and believe he is an honest man, but honestly I think times call for more than that.	0	1
538789	"What you don't think a woman is capable of being any more than a wife?  Or is it her accent that makes you think she isn't capable?  Maybe her Slovenian origins?  That she was an immigrant?

Gender?
Accent? Native tongue?
Slovak?
Immigrant?

What's the issue?"	0	0
306384	I would hope that our existing politicians felt the same as this man did. The world would be a better place indeed.	0	1
6126955	"Typical, yet unsurprising that the democrats would like and embrace this sexist, homophobic and mysogenic rapper who talks about raping women and beating homosexuals.
The party of tolerance."	1	0
5969892	Please tompaine are you really going to try to defend bill Clinton's long and storied history of raping women? Starting with the poor girl he raped to get booted out of England and his Rhodes scholarship? Over 40 women have come forward and accused him of rape ... which one would you like to start with ?	1	0
1043132	"islam and muslims have a dimmer view of gays and women, but, unlike milo, they practice what  they preach.
as far as i know, milo has not incited violence, promoted hatred, or acted against the groups he rails against. the market cut him down, which is difficult to do with legislation. he did leave us with one good quote that the snowflakes should remember: ""f... your feelings."" 
that said, I am glad he's gone."	1	0
5616720	"""Behold, this was the guilt of your sister Sodom: she and her daughters had arrogance, abundant food and careless ease, but she did not help the poor and needy.""      there is a lot of difference between rape, the sin of Sodom, than consensual sexuality.   and back then, homosexual rape, like any kind of rape, was a means of asserting power over a defeated enemy.   the sin of Sodom was rape, pure and simple.  it had absolutely nothing to do with homosexuality as we know it.  and you also know that not all gay men have anal sex don't you?  so therefore they aren't sodomites, neither are lesbians.   but, by your line of thinking, many heterosexuals are!  why aren't you condemning them?  why only gay men?   once again, you really need some good therapy."	1	1
5451114	The woman is a idiot but when you pushing BLM,LGBTQ,white hatred,Islamophobia agenda it's exactly what you get	1	0
6047764	Respect is not a God given right, as far back as I can remember it had to be earned. Black men will never gain the respect of anyone until they learn to respect each other. 73% of all our black children are born out of wedlock in single parent homes. The black neighborhoods chicago and beyond are riddled with crime, drugs, gangs, prostitution, murder, blighted neighborhoods, domestic violence, no work and poor education. The number one cause of death of black men between the ages of 18 and 34 years is black on black HOMOCIDE!!!!!  How can they expect anyone to respect them when they in turn do not even respect each other. These millionaire football players are completely out of touch. If a police officer never killed another black person, there would not even be a little dent in their plight. The football players need to give back more than 60 seconds on their knees to their brothers. It will take generations of hard work, they need to be active in addressing the black problem	1	1
416749	Of course Marty Rany is still wearing his shirt unbuttoned down to his belly button! He has to distract viewers from his male pattern baldness and obnoxious personality somehow.	0	1
767740	This is the best move to make on Putin and his unscrupulous hacker cohorts. Even then, some GOP lawmakers from the deep south are on the warpath and its only because they're cowardly bigots from the get-go. Obama is Black. They're white folks and how dare a black man get in front of them. Cowards. Racists.	1	1
455626	Nick,  Hillary Rotten Clinton is vile and evil.  She is an embarrassment to all women of integrity.	1	0
669743	Seems like the women who opened fire in the parking lot needs a little court time.  She endangered a raft of people in a non-life threatening situation.  There is no defense for her actions when her life was not in danger.	0	0
6141591	"Good looks, attractiveness, sexiness, charisma, etc. are all required for the most desirable entertainment industry jobs, particularly acting jobs, and particularly for women.

The actresses we have been hearing from are serious actresses, not porno stars or using ""hyper sexuality""."	0	0
865785	Next up from Leah, why I make my son sit down rather than stand when peeing. Including a very personal life experience exploration of why standing is a hostile expression of male patriarchy.	0	1
5873301	Damn, there I was thinking, what do you know? An article from the Sequim Red Rag that doesn't include some America bashing? Nope, never going to happen. This racist tool blamed White men with guns for ruining the country. America is not going to start a race war like your heroes Obama & Hillary wanted, so how about you move to Iran to be with your own people, and wait for the bombing.	1	1
5325949	THIS is why Tiger is a perpetual jerk...and why he will never get back on top (unless we're talking about another burlesque performer)...he runs from his responsibility, and owning his sh1t...he blames everyone for his poor decision making except for the man in the mirror...he is touchable, and he still thinks he's not...karmas a b1tch Tiger...and so, apparently, are you...man up fella, you will never be free to grow until you do.	1	1
874640	"Deborah, this march is, more than anything, a march telling Donald Trump that women will not tolerate his ""Grab Them By The Pussy"" misogyny laden philosophy.
I see that you are a big Trump supporter (from other postings) and submit that is your main motivation for trying to discourage women from marching for equality."	1	0
687530	I'm sure Fr Reese would agree and suggest - how about some female ones?	0	0
5530566	Andrea Stairs is the female Donald Trump. Unqualified, arrogant, horrible hair, and extremely creepy.	1	0
6136195	"Of course she can't comment. She made Monica Lewinsky, a victim by HRC's own so-called standards, practically have to wear a scarlet letter on her forehead because of the original predatory sexual deviant, Bill! HRC talked total trash about ML. Remember his tv broadcast (""I did not have sex with that woman"")???. No way can HRC be trusted to tell the truth or protect these victims-she's too busy protecting her sicko, pervy husband, which is a way bigger priority in her life than protecting women she doesn't know or care about. When is SOMEBODY going to tell the truth?"	1	0
6242464	"The dominant nudity taboos in Canadian society as reflected in, for instance, public swimming pools and their changing rooms, allow adults to be nude or ""immodestly dressed"" in the presence of small children and other adults of the same sex. For niqab wearers, approximately the same rules apply; the only difference is in the list of body parts that it is immodest to expose to public view.

Since that list is arbitrary in any case, the inclusion of women's faces on the list of taboo body parts is not a difference in principle, just in detail."	0	0
5448590	"Trump supporters logic:

A dozen women lied.
17 intelligence agencies lied.
James Comey lied.
The media lied.
Obama lied.
Putin tells the truth."	0	0
1004471	"oh pls pls do have the statistics published on a national basis.  The Halton Police review is in...results? Unfounded as they initially reported...shocker!!
I guess a thank you is in order to Ms. Doolittle for forcing the police to confirm what most already knew......that some women lie....often. 
Of the year 2016 cases reviewed, Halton police found 15 did not occur, the remaining 42 cases were found to not have been true after a ""thorough investigation.""

57 lives not ruined!!! excellent!

thanks globe...thank you so very, very much!
 really can't thank you enough!"	0	0
6150650	"The Longmont Chamber of Commerce is no doubt cringing, between this clown and the ""good woman with a gun"" saving the town from the squirrel threat. (See adjacent Article.)"	1	0
779063	"It makes zero sense that you commit treason of our lands for a foreign government. It makes zero sense to pillage BC of various rainforest with trees over 1,000 years old because a stupid man wants to sell CDO's and BBB's on the stock market.

and believe me, I will rip your balls off for lying."	1	1
5659904	"And all because, like Otto from A Fish Called Wanda, they don't want anyone calling them stupid. 


FSM forbid someone should ever describe Donnie's base accurately. Bitter clingers, Angry White Men, deplorables, etc...it makes them clutch their pearls and then head to the polls to prove what the opposition says about them. SMH."	1	1
4987608	"Because it is our Church as well.  We worship at it and we contribute to it.  We hate our right to have our voices heard about these things.  
Let's just give some examples:
1.  Apparently until this year, religious sisters weren't invited to the main Vatican session for religious.  In this case these women are directly affected by these regulations but had say in them.
2.  A pastor can basically do whatever he wants with a parish.  He has the right under Canon Law to act as a dictator.  Again lots of laywomen who worship at the parish can be ignored.
3.  Women are affected by requirements for marriage and the other Sacraments, parochial school registration, annulments, etc.  Laypeople are rarely consulted on these things.  
4.  There are charities, hospitals, etc. run by sisters and laywomen.  These women find themselves on the losing ends of arguments because clerical collars always win out.  One sister in AZ was excommunicated for authorizing an abortion for a sick woman."	0	0
5135201	Liberal women are so #^king ugly!	1	0
5248564	There isn't any common sense any more.  TSA is a total waist of tax payer's money.  You put all these agency's  under one name, Home Land Security and it's suppose to work.  What that poor woman should be doing is getting an attorney and suing the hell out of Immigrations.  Major problem, you have agency's within agency's, to damn many chiefs and not enough Indians.  Questioned about her school record......damn, that's a new one.	1	0
1009393	Getting sick of hearing about this. Many women make false rape accusations and we can't pretend that it never happens. Read about the Edmonton cab driver who was falsely accused because some drunk women didn't want to pay their fare, lucky for him he had a security camera which exonerated him. Feminists aren't going to be satisfied until there is a guilty until proven innocent standard for sexual assault cases. We can't let it happen. Women who make false accusations should get the same punishment that a rapist would get, pay restitution to the wrongly accused and be put on a sex offender registry for life. Accused people should remain anonymous unless actually convicted with solid evidence, not he said/she said cases.	0	0
517897	"The FBI stated they didn't have enough evidence and she has been investigated since the 90s, but any day now we will find evidence that she did it. 

Any day now she will be found guilty.

Meanwhile, Trump runs around opening talking about sexually assaulting women and refers to his daughter as a piece of ass he would like to date, and the integrity question falls to Clinton?

What reality do you live in?"	1	0
555462	"I have said all along that Trump could win, and some polls show him ahead today.

Your remark that polls showed Carter ahead can work both ways. If polling shows Trump to be ahead, he still could lose, even by a landslide.  I would hate to see this nation under Trump, who doesn't know jack about governance, and thinks going bankrupt is the way to get ahead, and grabs girls and women by the p@$$y as a way to get acquainted. Maybe he and his buddy Vladimir can fix everything up in the Middle East?  Frankly, I think anyone who admires Trump is a creep, imbecile, or sociopath.  But hey! that's half the whities in Amurca!"	1	0
6052235	"What a smug jerk. As if her degree in library science qualifies her to advise ANYONE on what books they should read on any subject. I suppose if the first lady had sent science books, this pretentious idiot would be recommending books on string theory and quantum physics. What she really wanted was to show her peers just how clever and sensitive she is, and try and embarrass someone who was trying to do a decent thing.
I'd like one person on here to tell me with a straight face that if Michelle Obama had sent the same books, this woman's response would have been the same."	1	0
982081	Once women get liberated the birth rate plummets, not much you can do.  The Comanche were lords of the plains for a while, didn't stand a chance against the settlers having 10 kids and pouring in from the east.  History is connected with fecundity.	0	0
744462	I always support your humor, but really, shouldn't you reign it in a bit.  Generating a nonsensical resume was a hoot and I think many enjoyed the inflated claims, but this last posting, my, anatomical area?  Is that really proper?  Hardly, for a good christian woman.  Or is this more of the satire?  It's so hard to tell, your rants are so over the top.  Keep up the funny!	0	0
940544	"Milo Yiannopoulos is a senior editor at Breitbart News. The creeps and freaks at Breitbart prop him up because, as a self-loathing gay man, MY is useful to them. They promoted his “tour” from the get-go: ""Suck It Up Buttercups: Dangerous F*ggot Tour Returns in September” (7/6/2016): www.breitbart.com/milo/2016/07/06/milo-yiannopoulos-dangerous-faggot-tour-returns-campuses-fall/
MY is pathetic, more to be pitied than scorned. His message is right wing cliches that are notable only because they are spewed by a gay man who both encourages gay men to stay in the closet and flaunts his own homosexuality for profit. To protest his appearances is to treat him more seriously than he deserves. On the other hand, of course, people have every right to protest if they so choose. They do not have the right to commit violence, to do harm, to cause damage; they especially don’t have the right to stop the man from speaking. It’s incredibly stupid. It transforms a pathetic figure into a sympathetic one"	1	1
5608799	"""Woman goddess"" is not a new idea. It has been pushed by the advertising industry for decades. As for the movie itself... Nothing more than can be expected from a Hollywood movie these days. No subtlety, no class, substance or depth, you are spoon fed corn the entire length. Yes the CGI looked shiny. Yes the starlet looked like she was in a perpetual cosmetics commercial...  As entertainment I found it unremarkable and lesser than its comic peers (Guardians of the Galaxy 2). The idea that this is somehow being talked up as a monumental work of art for Israel is sad."	0	0
5776740	"The Damore essay parroted the biology and psychology he cited.  Jordan Peterson, Phd. in psychology with a clinical practice has seconded Damore's citations adding that forty other specialists in the field stated he had correctly applied the material.

Henein made no such assertions and her training is law.  She ridiculed Damore's presentation with an attempt at being cute, ""Golly gee, if only I could overcome my natural biological disposition toward feelings rather than ideas..."".  It is at this point she confuses a statistical distribution of traits as a specific criticism of the female of the species.

As Damore's critique of the echo chamber at Google was validated by his expulsion so has Henein's fit of pique in defense of 'woman' reinforced the existence of her in-group bias.   How sad to see in-group bias be the source of perceived injury as it is in Henein's article,.  Sadder still is her intolerance for what she has misread as a critique of all women when she speaks for them."	0	0
5093934	This woman is the last thing Seattle needs. It would take us from dumb to dumber.	1	0
338525	A courageous man, in and out of the ring. When few would speak out, he risked his life's work to correctly point out the misguidedness of the Vietnam War. Certainly, he joined a Muslim religion, but this must be looked at in context of the black struggle of its day. I'm amazed at the conservatives who hate him for his belonging to a group seeking rights for its minority members, and doing so in a forceful way, yet these same white folks have no problem in strongly supporting idiots like the Malheur vigilantes whose only goal is to personally profit from land that belongs to all of us.	1	1
716632	"My Dear Two Centz, 
You serve up delicious and fallacious red herring.   We haven't been arguing about women keeping silent.  We have been arguing about ordaining women as elders. 

You are correct.  Seventh-day Adventist church leadership always argued women should play an active role in the life of the church.   But when WO came up,  they consistently argued against ordaining women as elders (leaders,  sometimes aka heads or chiefs).   You can't refute it so you deliberately try to change the topic of debate.   I do like fish!"	0	0
4975218	it is quite clear the left here live in both hate and stupidity as clearly exampled by your post yet again bud.. the people voted for someone from business out side of normal politics and they are getting a real leader who is actually doing what he said.. then you go off on the usual russian bs stupidity yet agqain, man you are going to be around for 4 years posting this stupidity over and over, UNBELIEVABLE	1	1
895571	"Don't disagree that these dress code for women are sexist, but she knew what the rules were when she was hired.

Don't like the dress code.....Don't except the job."	0	0
743189	Low fat during pregnancy is not a good idea. Fat is great for brain development because the brain is mostly fat. Studies have shown that a low fat diet during pregnancy can lead to post partum depression because of the body taking it from the mothe's brain to give to the baby. I eat only wild game and grass fed sources of fat. Luckily, I was able to keep down food like this thanks to pot and I believe that helped keep me from getting post partum depression. A lot of women end up on harsh anti depressants while nursing because of ppd and that's legal, socially acceptable because the pharmaceutical companies and doctors make money. I couldn't hold down fish oil until late pregnancy but once I could I took krill oil. I recommend you read a little about ppd and hg. You'll find you have no idea how impossible eating right can be for some women with hg and how hard hitting ppd can be. There are horror stories about ppd and pharmaceuticals driving women out of their minds. It's no joke.	0	0
6117878	In Alabama a man has been posing as police and has been accused of rape. So yeah I would not trust some random guy on a motorcycle.	0	1
6218931	"Just painful to read.  Far too many unsubstantiated and seemingly concocted narratives that for me. simply do not ring true in the real world.

What bothers me most is the huge tendency to attribute personal characteristics to a gender.  eg.  Donald Trump is a pig.  Harvey Weinstien is a pig.  Therefore being a pig is a male characteristic.  The implication is that, to varying degrees, it is in all of us.

I'm not buying in.  I am responsible for my own actions.  Harvey is responsible for his.  I am not sharing responsibility for his actions just because I have a penis."	1	1
6213070	You were good up until homosexual and heterosexual behavior are equally natural.  IN addition to both having the potential for STDs, one has reproductive value, and the other is barren, purely self-gratifying.  Moreover, homosexual men have demonstrated in the ever increasing HIV and other STD epidemics that they are unable to control their sex acts relative to heterosexuals.  Male homosexual monogamy is an oxymoron.	1	1
