id	comment_text	toxicity	gender
996167	First of all.  Edelman's catch was a freak of nature.  3 defensive players grabbing for the ball.  And all those bodies kept the ball in play.  No way that should have been caught without them.  Now putting that aside,  naming Brady for a Madagascar Hissing Cockroach is a thing of beauty.  Brady's hiss takes 3 forms:  a disturbance hiss which is applicable to Brady cus he is old and only older Madagascar Hissing Cockroaches can do that;  a female attracting hiss which I will not talk about at this time;  and the aggressive fighting hiss, which only Brady can qualify for that (a few years ago he made 2 TDs in the last minute of a game.)  Thus the zoo equating a Madagascar Hissing Cockroach with the Patriot QB is one of the greatest compliments of all time for Brady.   Remarkable!  But I still say that Edelman's catch was a freak of nature.  Then again with the Hissing Cockroach;  his fighting quality may have meant that if the catch was dropped he still may have pulled off a win.	0	0
481066	How do you steal thousands of pairs of women's underwear without shoplifting or burglary charges as well?	0	0
6185520	So what about the the anti woman, pedophilic antics of Donald Trump?	1	0
6273121	You use Penny Sparrow to build your argument. Why not use Emmet Till who was accused of grabbing a women, wolf whistling at her and asking ''what about it baby''. She was believed by all, instantly and Till was bound to the back of a truck and killed in a barn. That is what happens in the extreme if we follow your legal logic and believe, full stop. Remember we have a sad, bad history of race relations and passions are still high and of late the ruling powers are using the race hate card to keep themselves in power by any means possible. I believe Ferguson but that does not give me the right (an outsider with zero influence or at all attached to either party) to sit in comfort of my computer and pretend I am the most moral person around, boosting my ego. Can I add to the debate/action that adds to the future protection of women and all the other groups who suffer pain? If no then I should confine my posts to support of the victims and not trashing the accused.	0	0
5244447	"Once advanced the unpopular idea that Hillary Clinton wasn't really electable. 

Previous unpopular ideas include the earth being round, Darwin's Law of evolution by natural selection and a woman's uterus falling out in a marathon."	0	0
348685	Hateful rhetoric only comes white male right wingers...don't you know anything?	1	1
6037649	It's become a public issue not because she is a woman coaching a D1 team, but a head coach dressing below the norm established by her contemporaries, many of whom are and have been women.  She shouldn't have to feel like she needs to be more presentable, but maybe she should want to dress more appropriately knowing her position at the school and the attention it brings.	0	0
565939	"""Of course, I'll also remind him of his ""welched bet"" with every response to his posts on this site until one of us dies.""

gary -  you've vowed numerous times to not respond to my posts yet you continue to do so.  You're not a man of your word.   If anyone welches, it will be you."	0	1
5641353	"what ?, hypergamy ?
neeh, they just become 'traditional alpha men'"	0	1
984580	So....morons protestors blocked I-5 today near Bellingham.  The result was a four mile, hours long backup.  Oh...and to add to your pathetic protest whining...you were responsible for a terrible rollover accident in the backup that trapped two women in their van.  The first responders had to drive the wrong way on the freeway to get to them and were delayed doing so.  The women were extricated from their vehicle and taken to the hospital in serious condition.  So, social justice warriors are you proud of yourself...say tough crap for these women?  And what exactly would you say if it were your family member or friend?  You idiots are breaking the law by doing this crap..you make th choice, you had better be able to live with it...and probably going to jail for your lawlessness.  Civil disobedience is against the law for a reason...remember that when you engage in it.  We have run out of patience for you worthless crap heads and this will end.  It's up to you how it does....	1	0
494858	The only place tRump is happy is when he's in his Vietnam bedroom trying to pound unsuspecting women.	1	0
732761	Boy is this guy full of crap!	1	1
5912447	"bit on 50K vs 250K is purely fake news, please G&M call them on it instead of just repeating it!  JT and Morneau have no integrity and it is showing badly. How about the person inheriting a massive trust fund? or the CEO getting paid in stock options, these are ok right JT? 

Calling in a favor from nurses to truly continue their class warfare. 

""In terms of women professionals, nothing in our proposals will present a problem for women to continue to save within their corporation.""   EXCEPT, you know, the bit about punitively taxing these very savings so its harder for them to save for maternity leave??  

This government seems to be making it up as they go along.   We don't need these trump style misinformation divisive politics in this country.  Wow I can't believe how low they are sinking so quickly."	0	0
1056644	"...you're right... women should be prim and proper as well as barefoot in the kitchen.

Seriously, this isn't the 1950's; women aren't porcelain dolls to be posed to your liking."	0	0
632606	"Clearly a significant percentage see huge theological/Biblical barriers to Women being ordained as Elders.  Voting, polling, majorities - what do these add to the discussion?  A Union dividing itself from the General Conference will find itself a divided Union.    

Frankly Monte, When someone asks for proof you ought to provide it.  Instead you ridicule the skeptic.  Some might call your bad behavior uncivil."	0	0
5995031	Perhaps carrying mail everyday led to his disability. Years ago I took some classes at CCD community college. The place was filled with middle aged women who had debilitating nerve & muscle damage in their hands/arms due to food prep/deli work in Kings & Safeway. Braces up to their elbows - denied workman's comp of course, denied SSDI. They were panicked about their future and in pain w/no health insurance.	0	0
5518603	These two ladies are either ignorant or hopelessly stupid.	1	0
895222	My question is why do millions of feminists in the west condone their governments' camaraderie with oppressive regimes around the world.  Why do millions protest a president who has only just been elected instead of a monarchy that holds women down with social cruelty and religious shackles over generations?	0	0
5503750	An affair is very (stress very) different than grabbing pu**ies, making fun of women during their monthly biological cycle, criticizing women for how they look and sound, etc.	1	0
5099911	"how do u sort out a false accusation form a true complaint - how many men who never assaulted anybody had their live's ruined by the false accusation?
now, we look at the false accusations and how it impact real victims? will true victims ever be believed due to influx of false accusations -
what will be the penalties for the perps of false accusations?
its alright to ruin the life of an innocent man, that's beautiful cant wait to hear the excuses then"	0	1
5173458	"Why did you allow those deaths if you're so concerned about women? Where were you? Where and what are you doing now to help? You're retired - are you volunteering or working in any substantive way on behalf of the women you're so fake concerned about? 
Talk is cheap."	0	0
336400	Things will change and more and more women and people sympathetic to nature will have more and more influence in Alaska and a few of the so called trappers and skin hunters will fade hopefully. Next it would be nice to see the use of 4 wheelers and snow machines banned from more areas. Game will come back closer to the roads and you can pack out what you need on your backs like it should be.	0	0
5961348	"Man, you really don't get it, do you?! These are professional lawyers, who should not need to be told how to behave decently in public, especially when they are with a client in their lawyer role!  It's unfortunate (disgusting) that civil decent behavior is no longer expected as the norm.  And don't be calling me a ""whiney"", either!  Perhaps you are the one who needs a few courses on civil behavior!"	0	1
5295683	That's not untrue, but it's till a disingenuous reply that misstates Denglish's contention. Before it was more or less 50-50, enrolment was overwhelmingly male. I'm sure you'd both agree on that.	0	1
6264867	"The vast majority (upwards of 70%) of those employed in Canada's Public Service are women.  Ditto for elementary and secondary school teachers.  

Where is the 3000 word newspaper article advocating that this is a problem that needs to be address?"	0	0
437602	"Good point...guns just hurt people's feelings - they certainly are not capable of anything more.

Of course the same can't be said of those that wish to marry the person they love, those that wan't to smoke marijuana or women that try to have medical procedures...those are rights people should not have as they do much greater damage than hurt people's feelings."	0	0
5435207	"You tell me.  This is the $20 million question.
Anything that discusses the downside of multiculturalism is deemed some type of ""ist"" and some type of ""phobic.""  Yet, we are also supposed to encourage a religion that treats women like second class citizens, forces them to cover their heads and in some cases their entire body in a sheet, and throws gays off buildings.

I am all for multiculturalism, but I am just against misogyny and homophobia.  But the G&M Censors want allow it.

So, here is something for readers who disagree with these comments.  Instead of running to the G&M censors, try posting a comment in reply to why you disagree with statements that people make.  (I bet you won't.)

Thanks for bringing this up Exetertailor!  

And for you folks out there that want to tar and feather everyone as a hate monger because they dare to bring this up, remember, most if not all of us are good folk, but we have concerns and would appreciate being validated in our thoughts, just like you."	0	0
5611234	DeVos is a sham, scam, unqualified, misguided woman with a huge pocketbook, which impressed Trump. She is trying to destroy public education for the sake of private education (corporate education).	1	0
6301927	Yeah, uppity women should know their place.	0	0
311886	MAN--PUNY insolent-idiotic  MAN-- CANNOT even do anything to try to convince NATURE to change its ways---global warming IS----was and always will BE----	1	1
504288	"I don't know of any woman who would have anything nice to say, or who would not hurl a few expletives at their husband's paramour or paramours. That does not mean that Hillary is anti-women. Trump on the other hand, refers to women in so many demeaning terms, including ""piece of a*s"". He cheated on his wife, had a child out of wedlock, bilked banks, contractors, taxpayers out of millions. I'm with Hillary. This country did well when the Clintons were in charge last time."	1	0
549330	Thank you for a (a) clarification from a medical professional, and (b) sharing your journey with the issue as well.  You certainly help to insert a great deal of reason into a back-n-forth chatter of ideological vs, personal experience (by women themselves) that degrades as it goes on.  It is what happens when individuals focus on legalisms rather than also acknowledging the human dimensions.  You provide us all with some of both.	0	0
5732355	Raping the women and children Americans will not rape	1	0
5125373	He is in a LOSE situation because, as he said in his FB post, he enjoys hitting women. Most people don't like that and much of his on air persona comes across as disingenuous and hypocritical as a result of his admission.	1	0
4979051	"I doubt he'll do much, if anything.  He's probably relishing the thought of a new nation called Amerussia and is imagining things like the national color (Gold, of course), the national flag (black background with a big gold ""T""), national mascot (women), and national motto (We Are Yuge!)."	0	0
5216102	"Wanting to do that isn't following the Bible (but, it seems Durand's equally concerned about atheistic fascism violating the Constitution...). Jesus told Christians to share the message of forgiveness of sins and reconciliation with God through repentance, his lordship, and faith in his payment for our sins for us, but never wanted it physically or legislatively forced on others by his followers (Luke 9:5 ""If people do not welcome you, leave their town and shake the dust off your feet as a testimony against them.”), and did not want moral behavior (not involving types of assault, i.e. murder, rape, theft, etc) enforced through penalties, an example being his getting a woman caught in adultery out of a death sentence (though he also warned that that type of behavior, continued (and really not just that, but a whole life spent violating all the Ten Commandments in thought and or action, and rejection of God), could land her eventually in hell, but aside from a warning, she walked free.."	0	0
5699986	""" it’s just that as a woman in her 50s, I am part of an invisible demographic. They don’t know what to do with us""
It has nothing to do with your gender, it's all about age. See how many 50 year old guys you can spot in IT... pretty close to 0 in most departments I'd bet. In fact I daresay it is worse for guys because they do not benefit from the imposition of gender quotas."	0	0
331792	"Two serial philanderers is too funny of  thought with six marriages between the two. Trump would get even less ""respect"" with the women, than he does now. According to L. H. Carter, Gingrich's campaign treasurer, Gingrich said of his first wife: ""She's not young enough or pretty enough to be the wife of the President. And besides, she has cancer."""	0	0
5306367	"The Manchester bombing was a 'group' ISIS effort with Dad & Bro planning to detonate a bomb in Libya.. so this attempt at domestic terrorism labeling is simply the avoidance of a greater snaking consumptive Planetary problem -- Islamic radicalization & terrorism.

Here's an idea -- how about surveying the young girl population of both the United Kingdom & North America... and ask how they feel about 'terrorism'..

. . or do those Human voices count?

Therefore, how about dispensing with the 'personal bias' & take a good hard look at the 'Common Denominator' here, which is 'Islamic Jihad' -- operative word being 'Islamic' as in Islam.. c/w horrific cowardly terrorism & ask this question: 'What the hell is slowly augmenting to smother freedom for these young women -- & Why?'

And so here we go again -- unleashed insane stupid misogynistic religious prattle from just another primitive gaggle of self-professed crowing Holy Roly cockadoodledoos.
https://www.youtube.com/watch?v=gJ493mj27I8"	1	0
926217	You, John Titior, and several others here should stop taking foreign visitor visas looking for children to have sex with. Studies show 85-percent of child sex perpetrators using tourist visas to Latin America are white men.	1	1
6300371	"That's a liberal misunderstanding.  I know it's hard to believe, but college-educated women of all colors and economic status voted for Trump, too.

This mentality is why the Democrats might never win another election.  You focus on division and hold elitist, smug attitudes about those who disagree with you.

And let's be real, shall we?  The country is still run by a bunch of old white guys."	1	0
894737	I agree with you Don227. If there was an article disparaging women as idiots there would be a protest and a parade.	1	0
5972729	When will these young women who want to showcase their bare skin show up at  Grocery Stores??????   That would put a whole new meaning on the MEAT Dept.....	0	0
978888	"Lies, damn lies & statistics. Let’s not kid ourselves, unfounded means for the most part lies, deception, or lack of any corroborating evidence.
Ms. Doolittle’s report can be interpreted many ways. Perhaps some Police forces are better at detecting lies. Perhaps some Police arrest people regardless of any real evidence to mitigate their unfounded rate.
Her stating statistics (2-8% is accepted false reporting rate) without citation of any kind is not unusual for feminists. They like to present “alternative truths” on a regular basis.
In the feminist bubble, it’s unfathomable the rate could be higher, cause you know…’sugar & spice & all things nice’.
I wonder, if after reviewing all the past cases the Police determine they are in fact unfounded, what will Ms. Doolittle’s response be?
Admission of a much higher unfounded rate than 2-8%?, admission that women may lie more often than she currently believes? I guess we'll have to wait and see...."	1	0
6263846	I look forward to Grootes admonishing women who protest against rape of being sexist.	0	0
6120026	"Prominent Hollywood liberal sexually abuses women for decades.

""There were few people surprised or shocked at the news of the allegations against Mr. Weinstein, and far more people expressing exhaustion that comes with recognizing its pattern.""

Oops, lets change the headline.

Prominent Hollywood liberal sexually abuses women for decades, prominent Hollywood liberals look the other way.

Let's break out those P ussy hats once again, this really puts Trumps ""grab 'em by the ****"" comment in perspective."	1	0
5283896	one of the best if not the best ever to coach women vball. shoji not only won but he did it with dignity.  he is just a top notch person! intelligent, competitive, humble.  we will miss coach but hope everything keeps going well for his health. happy retirement coach you are truly the best.	0	0
1059110	Richard showing his insecurity with women in the workplace.	0	0
6184663	It is NOT the women that the public is upset about. It is about a culture that restricts and represses them that has imposed misogynistic rules that are not tolerated here.	0	0
966780	"This sounds more like therapy than a judicial process that is meant to make recommendations based on conclusions from facts. I'm not saying therapy isn't needed, but this inquiry is more cathartic drama than a process that's going to get any thing done. 

Here's some ideas that would work:
Get a shuttle on the highway of tears immediately.
Put women's shelters in Native Communities immediately.
Get appropriate Native community based housing with adult support from their own bands for girls going to school away from their home communities.
Set up transitional housing for Native women looking for work in cities. 
Have addiction treatment and mental health in Native Communities

But hey lets spend years and hundreds of millions (and that's what it will be) going over and over what we already know."	0	0
264533	This bill should be DOA before it reaches Governor Walker's desk.  Anti-abortionist need to get a life and mind their own business.  Roe v. Wade gives women the right to CHOOSE.	0	0
590571	"Whine, whine, ""Sara and Roy disdain the downtrodden white man"". Pathetic. It's clear from all the Trumpy comments that you just cannot bear to hear the truth so, as per your usual pattern, you ignore it."	1	1
5777409	"You're full of *hit. The ONLY group of people I've ever seen claim racial superiority is the white man. Just because Hawaiians want back the lands that were taken from them or their government does not make them ""Hawaiian supremacists"". I have never heard a Hawaiian claim to be better than any other race. I have however heard white men make the claim many times."	1	1
5358264	Wicked men have used religions to do terrible things correct. But in today's world there's only one which is murdering and raping its way across the globe daily. Christianity had a reformation and Islam needs one very badly. But don't get it twisted the atheists can be just as dangerous...look at how many lives Communism has snuffed out. Makes the occultist Nazis look like amateurs.	1	1
787391	You are insane, no white woman would go near him.	1	0
520079	Nothing has stated that the women were unwilling. Y'all just fabricated that and now believe it to be the truth.	0	0
636416	We did not need this explanation - The Church drove a campaign in favor of Trump. solely based on making abortion illegal. At the end, it all boils down to keeping women under their thumb - Dr. Klemper you are not deplorable, just a boring mysogynist.	1	0
5013634	Lay, replying here and to what you wrote to me above. Bart D. Ehrman points out that John of Zebedee was a Galilean fisherman and would likely not have had the necessary skill in Greek to write the Book of John. I'll add that perhaps John 21:24 means that the author has been informed by the testimony of someone who wrote earlier (perhaps John or Lazarus). Scholars often date the Book of John to a time (90 CE) when Apostle John would have been like age 90 (but maybe by then he had learned to write Greek?) I am not the least perturbed that women stand apart in the Synoptics and women stand by the cross in John. Maybe the women walked from one location to the other! Apostle John could possibly be the beloved disciple, but Lazarus is a better bet as the beloved and the original contributor to John, because Lazarus lived in Bethany and may have been more cosmopolitan than the sons of Zebedee, and also for reasons above. Who was the first scholar to propose John was the beloved at the cross?	0	0
5630450	"Exactly. It's why I intend to have ""inherited sin"" on my death certificate as cause of death, since so many think to themselves, ""Oh. I can see why HE died. Won't happen to me."" Well we've all inherited mortality since ""by one man sin entered the world, and death by sin, and so death passed upon all men for all have sinned."""	0	1
951493	"Wow. Want to see some nude pictures of Mrs. Trump? I've got some of her completely naked, some of her dressed up in sado-masochistic garb and one or more where she's in a sexual position with a woman. And what about her Peeping Tom, ""pussy grabbing"" husband? I guess that's ok with you. So you approve of Trump deliberately walking into nude and half dressed teenage girl's rooms during pageants, and bragging about it?  He did that with grown women who were pageant contestants too, of course. How about when he was bragging about ""moving in"" on a married woman (I think his exact words were ""I went after her like a bitch"") when he was himself married. Oh, there's lots, lots more. The bottom line is if you voted for President Pussy Grabber, you've done far, far worse than the women who marched with a symbolic pink knit hat on their heads, protesting the pervert you put in the White House."	1	0
5148720	Have you forgotten the women who served as nurses in previous wars.  What about the first nurse killed in WWII, did you not respect them.  Your proud of those who served, who come home wounded or in a box, what is there to be proud of.  Oh before I forget, I'm a Veteran, proud to serve, you being proud of the military, could care less.  Women served when I served, why not you.	0	0
667622	"Trump is a pig of a man.
Don't try to equate the traits of Donald Trump with the citizens of Alberta."	1	1
6284161	"While so many businesses are toxic, things are only going to get worse. 
More women will report harassment, when in fact, it is predicated on lies."	0	0
5375192	"""No...disruption was the intent.""

Yes,  Pandora17. The settled business of disruption -- whether at a wedding or Papal Liturgy -- never works. Not really. I guess the disrupters expected the police to be hypnotized, paralyzed by their burst of righteous fervor, hierophantic moment? No doubt the police sensed the women's feelings, ambitions to disrupt the liturgy -- as if to give the women the force of testimony -- were antecedent to the disruption itself.  The Anglican woman priest wisely took off to avoid making her lesser presence too central to the disruption.  No doubt her job was a stake and her own bishop would not have been pleased. What's next? lol"	0	0
793229	What about all those Catholics who do not believe that women should be allowed to become priests, oppose gay marriage and a woman's right to choose when it comes to abortion? All of those beliefs are not in keeping with Canadian values. I bet the author of this simplistic article would never dare to oppose immigration to Canada by Catholics. His is a cowardly, racist argument.	1	0
4460998	scary man, scary place, everything scary to allie	0	1
5183298	You are correct.  There is so much more to women's needs than the inexpensive contraception provided by PP.  Which is why they offer many other services.  Many people in this community would like an option other than PIMC.  Why is that a problem?	0	0
5490593	Good Lord this guy threw his life away. Who was his role model in interacting with women?	0	0
5610438	So Delta shifted the seat assignment for some stick person...get over it you nasty woman.	1	0
424327	Seriously?  1.6 million dollars.  The RG should tell us explicitly what the woman claims to have endured for us to evaluate the appropriateness of the verdict.  Does touching mean a hand on the shoulder or what?  Does sexual advance mean asking for a date or what?  People support this kind of thing based on emotional reaction rather than real information or understanding of what happened.  Personally, with that kind of money on the table I wish I was in the woman's place.	0	0
