id	comment_text	toxicity	gender
1026630	"The pope apparently is unaware that he himself is described as populist,  as he postures himself as standing for the ""little man"" against some perceived, generalized elites.  A man of irony indeed."	0	1
713507	"It is an unfortunate fact that the President has a lot more latitude for unilateral action in the realm of foreign policy than in domestic policy. The President-Elect's recent behavior (He seems to be trying to out-crazy Rodrigo Duterte.) suggests the world will be reliant on his puppetmaster Putin's good sense. Putin doesn't want to rule the world; he just wants the Soviet sphere of influence back. Beyond that, he wants the world stable, and he probably knows how to keep a lid on his puppet's ravings.

The Republicans in Congress have a lot more power over domestic policy. Unfortunately, this means they will be able to veto the Elect's intention to prevent the privatization of Medicare and Social Security, the abolition of Medicaid and the replacement of Obamacare with anything at all. 

Putin deciding US foreign policy and Ryan deciding domestic policy. All because the idea of a woman President was just too horrible to contemplate."	0	0
706690	"My kids were not poor but went without a lot of frills and public schools snatched money from us. Willing to PAY for the educational institution of my choice, I was still obligated to PAY into the top heavy puppy mills so that complacent parents could have their K-12 daycare. A simple voucher or tax credit would have helped me offset my expenditures into my children's education. Not steal money from yours.

Your link sources speak volumes about you. I contend that a picture paints a thousand words and a man with an experience is never at the mercy of a man with an argument. I've lived it. So call me a liar..."	0	1
6244632	"This might sound harsh and I'm ok with you thinking so... Here is my thought on what Masuma Khan had to say about the white people who can kiss her ass. It goes as follows...
Words right out of a terrorist's mouth!!
Masuma Khan posts on Facebook... ""White fragility can kiss my ass. Your white tears aren't sacred, your land is."" This doesn't sound very Canadian to me, sounds more like the threat of a terrorist. We, real true Canadians, don't take kindly to threats... You think we are frail - we have a surprise for you! Watch out white people - this woman will stab you in the back without thinking twice.
She should not just face disciplinary action for her racist remark... she should be put on the ""Terrorist Watch List"". What she said was a direct threat to the white race .. who are we kidding??
Her words are no different than those of the ISIS terrorist's who post their threats to the World Cup...
At least we white's know who our friends are .. definitely not her.
KICK HER OUT!!"	1	0
5298673	Hopefully the women tRUMp jr. talked to haven't seen the video of her piggish father and how he respects women.	1	0
632080	"The headline should more accurately read ""Female Soldiers"". Report the facts please."	0	0
4973637	Because the Republicans hate women.  Really, really hate women.	1	0
5542776	If this Asian women was in the middle of the Kakaako homeless encampment and started arguing with the other homeless about sitting in a chair on the sidewalk, you might have a point but not on a United Airlines airplane after paying tickets for both herself and her child.  If at some point the flight attendant calls security guards on this women and they threaten to drag her down the aisle of the plane, then yes, back down and leave but NOT just because some attendant tells you have to give up your child's seat, even though she already paid for it.   Too late for legal action at this point as she voluntarily gave up the seat already.    Maybe Grace Park who left Hawaii 5-0 on principal alone can help this woman gain some basic self-confidence?  Also not sure if the message she wants to give her child is that a physically diminitive Asian women can be easily intimidated in a business situation to give up what is rightfully hers and her child.	0	0
6265221	You can’t get a job today unless you go through a woman, it’s that simple. When it comes to problem solving, I find myself going in circles with no end in sight.	0	0
5994812	Is it unfair to suggest the undisclosed location could be an establishment that features unclothed female entertainers?	0	0
6187900	"I'm sorry, but when exactly did the young girls so wrongly taken by Boko Haram become ""OUR GIRLS"" because I wasn't aware that any of them were US citizens in general and Wilson's constituents in particular? Then there is also the question of when exactly in this nation's history did the word ""BARREL"" become a derogatory term for any race or has it now  become acceptable to remove any word from the English language at will by designating it a racial slur? 

I guess if  someone with the monumental hubris of a Frederica Wilson feels she can declare a whole group of abducted girls from another country on a different continent as hers as well as claim another woman's son as her own then appropriating what ever words she decides to assign racial overtones to is just her right."	0	0
528052	"Correct, Trump talks trash, while Justin assaults female MP's.


There is very much a difference Justin."	1	0
710386	"Forget an inquiry, I can't wait until Trump takes office and just releases and declassifies all of the intel. He'll do more to expose both the CIA and the Democratic Party's fake news than any congressional inquiry could.

Simply put, the Obama administration is full of crap.  They are lying.  They don't know that Russia was ""trying to help Trump"" because they can't know that, in the same way that we can never prove that $20 million in donations made to the Clinton Foundation by Saudi Arabia were given out of some kind of honest and sincere love of women's rights and gay rights, or because they expected something in return.  We can only reasonably infer based upon records and motivations.  

Remember, it was just last year that James Clapper was caught fabricating intelligence about ISIS to conform to the Obama administration narrative.  This is highly unusual.  Giving fake intelligence reports?  

http://www.businessinsider.com/obama-administration-and-isis-intelligence-2015-9"	0	0
5018958	"Whatever happened to the concept of the common good?  Christianity (and democracy) does not posit ""every man for himself"".  Governments exist for the betterment of the people.  Sure, we need a strong defense.  But we also need education, health care, safe environment.  These are not benefits - they are RIGHTS.  Every citizen is owed these things, no one should be precluded.  Everyone deserves his fair share; everyone should contribute his fair share."	0	1
951892	Why do you hate women Jason?	0	0
6178797	"It is saddening the you feel Muslim women are easy targets..I respectfully disagree though...

However, what type of person wants to leave their home country and come to a better place but feels they should start out by offending their hosts? To me that is despicable and arrogant behaviour. And not someone deserving of entry.  ""It is my right to go to Canada and offend people.""   Really?

Tell me can I go live in Saudi Arabia and wear t-shirts with a picture of Allah or Mohamed. I do not find that offensive and have respect for Mohamed; what would happen to me?.....would these Burqa wearers be okay with that...if they can be truthful of their support for that in their response they will have my support.

Otherwise their sense of accommodation runs one way...."	0	0
389196	Racial slurs painted on a boat; boat set ablaze: yes, this might be a hate crime.  You should do some volunteer work and take your mind off how tough middle aged white males have it today.	0	1
5741417	throughout their entire education (highschool, university and post), these google engineers have been rejected and humiliated by women.  They are finally in the drover seat and in control... Is it any wonder they reject women in tech?	0	0
6168025	Nenshi won because there was growing suspicion of who the people behind Smith's campaign were. That he refused to release the list of his donors was all the proof people needed. There was a concerted effort to load the school boards and city councils across the province with Conservative sympathizers, laying the groundwork for the coronation of a certain chubby little guy who wants to out kids who join GSAs and defund women's health procedures.	0	0
5190453	Good.  Now Jamie Gomer, woman in first picture on left, can use the extra $$$$ to get her teeth fixed.  Oral hygiene and care is important, especially if you're a college career counselor....whatever that is.	0	0
5362619	That was a lot of work to create a ridiculous straw man.	1	1
875941	What these femanazis fail to realize is that President Trump has hired and cut paychecks to more women blacks latinos gays lesbians transgenders and muslims than all previous presidents combined.	1	0
625649	Hey, I have some questions regarding that woman you helped a month or so ago. I'd rather ask them in private though. Could I give you an email address to contact me at? Perhaps a number instead?	0	0
5041671	Hold on Klastri...looks like under the Obama administration, Trump towers were incidentally included in wire taps, and then names were illegally released.  Trump may have a point, but even if true I understand that you will not accept the results. By the way, any comments about the young girl (Freshman in high school), who was raped in the H.S. bathroom by two boys, one 18 and an illegal immigrant from Central America? Wouldn't you agree that this works against Maryland's sanctuary city ambitions? Also, why would an administrator place an illegal 18 year old in HS with Freshman women?  Don't you believe the MSM should be reporting this? This constant anti Trump campaign must stop. It hurts every American citizen.	0	0
5021118	When all is said and done, Kenney is incompetent and unfit to lead a garbage truck.  The man is a walking dumpster fire.	1	1
6244128	"Right, because dozens and dozens of women have achieved fame and fortune by lying about sexual harassment and convincing the press. It's so easy to do, everyone believes them automatically, and they are never threatened or attacked for doing so. 

Can you name one?"	0	0
5939781	"So who's fault is this? Both sides looks like. What's her tiny dog doing loose in a car? Don't people know that in a car collision, a small dog will go flying like a miniature missile? It's this reason precisely that dogs should be secured with doggie seats. So what if it's not required by law. It's required by logic. I've seen people driving with their dogs on their lap. I also don't understand how the spilling of the tea could have gotten so out of hand (no pun intended). If you're handed a hot cup, you'll feel it's hot, and if it's too hot you calmly put it in your car's cup holder. Sounds like this woman never had to handle unexpected stress before and just plain freaked out. Kind of like a deer freezing in the road as headlights approach it, not knowing the sensible thing to do. Put the damn cup down instead of panicking and shaking the tea all over the place. I hope these factors come up in court. This harebrain isn't the first to be handed a cup that's ""too hot."""	1	0
859998	"Ms Strawberry is a strong, courageous and obviously very smart woman. My hat is off to her as I know how hard being a single parent of just 2 can be never mind 5 or 6!  I wonder what the stats are on how many mums in Canada are left to fend for themselves and their children.  Deciding to leave a marriage to be a single parent is a hard choice and not one made lightly. A mum often makes this decision for the welfare of herself and her children even knowing that financial and societal hardship are in store.  So for a childless adult below to criticize anyone who has made this step,  shows little understanding or thought.  I would just add that ""brood"" generally refers to a family of young animals, particularly birds so please don't use it to refer to a family of humans."	0	0
5812971	Don't act like a dick and you won't get fired. Seems so DIFFICULT for some men to figure out.	1	1
5082873	"Do U.K. police respond with the same alacrity or demonstrate the same amount of concern whenever a British woman is sexually assaulted by an ""asylum seeker""?"	0	0
351797	Ummmm, in light of recent events, the struggle is still very real for the Queer community ESPECIALLY Queer folks of color and trans women of color. Keeping our spaces safe from assholes like you who don't think safety is a priority for queer people must definitely be written about.  Please sit down and shut the fuck up.	1	0
6119192	"Jesus said NOTHING on the subject of contraception. No, those unmarried men, who had no experience whatsoever with married life or the place of sex in married life, made it up out of their belief -- derived from the Stoics, Gnostics and Neoplatonists -- that sex had to be ""justified""."	0	1
5303773	"Willy-nilly?

BRILLIANT! Buy that man a cigar!"	0	1
581309	Comey is bought and paid for. He's a wuss, not a man.	1	1
5950875	"Alan Parson's Satanic Babylon Working Ritual succeeded in 1946.
1947 a female Bitch was birthed."	1	0
670924	"Dennism, there are currently countless numbers of women's groups, some of them "" The Republican Majority for Choice, Catholics for Choice, Religious Coalition  for Choice ""and more, that are fighting for women's rights. Also the ACLU and Americans for the separation of Church and State, as well as informative websites like lawyer Marcia A. Hamilton's site and her books that defends against the RFRA's  so-called religious right Act that allows religion to cause harm to others, like women, other religions, genders and races. It is a bitter fight but I believe that women and others will win eventually. So I am not as pessimistic as you are."	0	0
5185710	John 6:44 - No man can come to me, except the Father which hath sent me draw him: and I will raise him up at the last day.	0	1
358228	"RG: ""Brown and Sainsbury were allegedly on the front porch, and broke a number of pots and damaged several plants...""  RG: ""Brown then allegedly threw the woman on the ground, police said. When the woman’s son tried to intervene, Brown allegedly grabbed him by the throat and pulled him to the ground as well, according to police.""   RG: "" Brown is an educational assistant for the Lane Education Service District, specializing in life skills and special education, according to the district’s website.""
 ++++ definitely some life skills in there somewhere. and some special ed judging by her ability to take down a 43 yr old woman and a 12 yr old boy at the same time.  good thing sainsbury was there for back up.  ms brown may also want to smoke some marijuana - sometimes takes the edge off those ""tense"" situations."	0	0
297004	A vote for Hillary is a vote for more national debt and massive immigration of cultures that do not accept us.  Obama has increased our debt more than all presidents combined.  European countries have completely destroyed themselves by allowing massive immigration of muslims. Muslims make christian conservatives look like peace loving liberals. Germany is projected to be a muslim majority by 2060 due to child births, at that point you will see Sharia Law put into place and women will lose all the rights they have fought for. Sweden and Norway are practically destroyed. Sweden is the rape capital of the world.	1	0
545454	Oh, so you believe in punishing women for having been raped? This is a Christian stance?	1	0
4985816	Off course it wasn't fine before francis, but it's much worse off now. It seems that if you love Latin mass don't want women priests or ssm in a RCC than your in the wrong. Chill out I disagree with francis no pope can be perfect can they!	0	0
334236	"This was no ""hunter"" that killed this female mother wolf.  It's too bad the wolves can't shoot back.  Wild animals don't give birth so their pups or babies can be put in a damn zoo."	1	0
6098605	"Trump, celebrating the one-year anniversary of ""grab them by the p***y"" by restricting women's healthcare. His approval by women is now at 29%, and this will drive it even lower. Maybe that's his goal."	1	0
6218972	See? Catholicism is no better than Islam. Both religions hate women and homosexuals.	1	0
861442	"As Iggy would say "" a smart woman when necessary but not necessarily a smart woman."""	0	0
393544	Neither woman wrote the speech, they're just reading off the teleprompter. Looks like the Trump campaign hired a speechwriter who gets hired a lot.	0	0
242858	"""Sexism is discrimination, prejudice, or stereotyping on the basis of gender.""  Except when it is demanded on behalf of women.   Then it is merely advocacy."	0	0
5449990	"The other one?

The Democrats failed to get the vote out. 
.
Again.

But I am absolutely positive they could get thousands of women, minorities, etc out to march in this very district next week. Old, white people love to vote, they do it more than any demographic (I still remember my parents taking my Grandmother out to vote - she insisted - past her 90th.) look for them to hang around in large numbers for at least another 20-30 years...
.
But hey, marching is more fun than voting....you have to pick your entertainment.."	0	0
6015985	It's women that will suffer with the demise of our liberal cultures.	0	0
6115787	"Oh Sidney
How naive
This move makes one come across like a perverbial dumb jock
Or privileged “white” man

The visit is ABSOLUTELY about politics. It’s a trip to the White House for goodness sakes! Why would ANYONE go to the White House these days what with that orange oafish bore for a host? Maybe a trip to the Whiye House wouldn’t have been such a big deal if Agent Orange hadn’t called fine young men “sons of bitches” for exercising their Constitutional Rights.

Anyways, Syd, Swiss “Neutrality” was a callous falsehood as people pretended nothing was happening because it didn’t affect them. 

But have a good time, Son."	1	1
5103081	My only addition to this wonderful analysis is the role of Church itself. While we belong to a Church that holds a mountain of spiritual wisdom and beautiful tradition we also belong to a Church that has, as an institution, fallen into the precise obedient, uncritical behaviour Joan identifies and a result women, the environment and those who have a separate spiritual tradition have suffered enormously. Let us lead by example and thank goodness the greatest part of our Church now does that.	0	0
546897	As a woman, I don't want to be told who I am, and I don't want anyone telling my daughter either.	0	0
5734308	Exactly! Everyone but liberals know that women are inferior.	1	0
6143441	"Based solely on the review, this movie sounds like a means for snooty intellectuals to justify their liking of a comic-book heroine. Progressive politics, the psychological theories of Freud and Jung, and -- for purely socially redeeming reasons, of course -- some fetishism and role-playing.
I thought the early-summer ""Wonder Woman"", starring Gal Gadot, told a perfectly fine origin story -- with Sigmund Freud, Carl Jung, or fetishism nowhere in sight.
I don't need fancy-pants critical theory to enjoy the physically-improbable sight of a woman deflecting two machine guns firing bullets at her with a mere flick of her metal shield."	0	0
5664583	i remember seeing two u.k. women on a shark tank style program. they got deep sixed because they did a crappy job, not because they were women although they wanted to make it appear so.	0	0
5274501	"""What in the world have I to do with L. Ron Hubbard?!""  I hope nothing - God Forbid. My point wasn't addressed to you specifically but to a theoretical person who would argue that ""men"" defined scripture and therefore it is polluted - that it must either be re-defined, re-interpreted in gender-neutral language, or entirely scrapped for new books to be included.
Please forgive me for being unclear... I didn't mean you are like Commodore (whatever) Hubbard at all!"	0	1
490212	Not only heartening that this woman had the means and ability to defend herself (this happens more often than is reported) but also refreshing that it is being reported in the mainstream press!	0	0
5377542	"Newt Gingrich, the Republican who persecuted Bill Clinton and preached ""Family Values"" abandoned his wife who was dying of cancer and ran off with a younger woman.
THAT is breaking your marriage vows..."	0	0
6329345	"""The second is the damage that former prime minister Stephen Harper inflicted on his own party during the last election campaign, when he criticized women who wear the niqab..""

Really?  What did Harper call women who wear the niqab?"	0	0
750205	"""when the man saw President-elect Donald Trump's daughter Ivanka, he ""did a double take and said 'Oh my God. This is a nightmare!'""
This is hilarious how this one guy is seems to fit the perfect liberal character. So fragile."	0	1
5980579	Aweh, I love when RWNJs pretend to care about women.	0	0
529884	Pepe: assuming you are a woman, I want to grab you by the pussy.	1	0
931696	"Old stock are salt of the earth, the rest could only wish they respected gays and women half as much!!! 

Why do you think people came to Canada???  Becouse of you or what your family did in their foreign land.

Wake up fool, you sound foolish - read some history books, we lived it cunt!!!!!"	1	0
6221156	And still the vast majority of those communal villages rely on women in particular to do the heavy lifting on child care. I don't believe this solution you propose has any relevant examples that promote gender equality or equity.	0	0
916183	SO i have said said so much about how itresponsible this was was already, because i almost died like within the same month. The fact this got to press is the press. The parents need to think about whether they really reminded anyone of rules before leaving on vacation or whether leaving a 20 year old male in charge is smart. Its all hard to say when your looking from the outside. Whether it could have been have been avoided and the 'younger kerns' protected is a wonder eh? You would not believe what hit following finding this anyway...princess Leah died, debbie reynolds died, Alan thicke DEAD, sza sza died, did i miss i miss anything...oh ya...IT WAS ALOT.	0	1
6169921	"Sure blame the Congress woman and the window of a killed soldier on being the liars... 

I saw Donald said he has proof this morning. Is this proof like the proof Obama was from Africa, or is it proof like head had on Obama wore tapping him.  Naa he's just a dumb rascist."	1	0
557337	"So well and firmly stated, Chris!  Thanks so very much.  It is already distributed to my mailing list and posted on Face Book.  Do you also count yourself as a ""Nasty Woman""?  When will we meet to chat?  All my love,  Tom"	1	0
5172301	"couple of key points, here:
""government job...""  Many are transferable.  She could sell out now (while the gettin's good--4 years from now is a real crap shoot.)  Live and work another 4 years in a smaller town--lots of options still for her as she is in that wonderful ""300,000 over asking"" category.

Pay off all debts.  Sure.  Dig into that house-sale equity to do it, because...

""pensions and bridge benefits...$3,600 a mo.""  This, and I presume she is a single middle-aged woman.  What's her PROBLEM??"	0	0
383005	Another informative and educational We Alaskans article so long missing from the old ADN.  Amazing woman.	0	0
1081084	"We do know some of the things that went on in that cab. A woman was so drunk, she peed in her clothes. She was taken far from her stated destination. She was three times over the legal limit and passed out within minutes. Neither she nor the cab driver had ever met before and the cab driver required a translator in court, so has only a basic understanding of English. As much of their brief time together would be spent driving, I cannot think that any consent was given. I'd be more given to believe that the cab driver assaulted her in revenge for her soiling his cab.

As to your own love life, I have no comment beyond noting that you likely have agreed to sex before drinking as she is your girlfriend. But be forewarned she can withdraw consent at any time and once she's said NO, you cannot claim consent. And once she's incapacitated, you cannot do anything not agreed upon before, such as adding a partner or other kinky stuff."	0	0
5965497	"At little thin-skinned are we? I made a comment about idiots, not women. Read the comment again. Or have someone with adult-level reading comprehension explain it to you.

No, I don't work at a hardware store. My education was in the biological sciences., as was (and is) the last 27 years of my employment. Next question."	1	0
848726	AdamMandel, I'm glad you think that women are independent voters.  That may explain why women supported Clinton over Trump by 54% to 42% overall.  (The figures you mentioned are the percentages for white women only.)	0	0
5833222	Trump is a punk.  He's going to mouth off one time too many and regret it when someone as thuggish as he is comes calling. Stupid, stupid man.	1	1
